{
  "version": "p5.m1",
  "record_kind": "governance_decision",
  "record_id": "opl-gov-2026-04-05-001",
  "request_id": "opl-2026-04-05-010",
  "workstream_id": "research_ops",
  "domain_id": "medautoscience",
  "summary": "Top-level decision is to reframe before further domain execution.",
  "status": "needs_human_review",
  "evidence_refs": [
    "human_review=pending",
    "governance_signal=reframe"
  ],
  "domain_truth_refs": [
    {
      "domain_id": "medautoscience",
      "ref_kind": "review_record",
      "ref": "medautoscience://reviews/study-001"
    }
  ],
  "recorded_at": "2026-04-05T06:21:00Z",
  "governance_decision": {
    "decision": "reframe",
    "decision_source": "human"
  }
}
